<?xml version="1.0" encoding="UTF-8"?>
<databaseChangeLog
        xmlns="http://www.datadrift.com/xml/ns/dbchangelog"
        xmlns:xsi="http://www.w3.org/2001/XMLSchema-instance"
        xsi:schemaLocation="http://www.datadrift.com/xml/ns/dbchangelog
        ../../xsd/dbchangelog-1.0.xsd">
    <!-- Example changeset: Custom SQL -->
    <changeSet id="003" author="jane.smith">
        <comment>Create custom function for updating timestamp</comment>

        <sql>
            CREATE OR REPLACE FUNCTION update_updated_at_column()
            RETURNS TRIGGER AS $$
            BEGIN
            NEW.updated_at = CURRENT_TIMESTAMP;
            RETURN NEW;
            END;
            $$ LANGUAGE plpgsql;
        </sql>

        <sql>
            CREATE TRIGGER update_users_updated_at
            BEFORE UPDATE ON users
            FOR EACH ROW
            EXECUTE FUNCTION update_updated_at_column();
        </sql>

        <rollback>
            <sql>DROP TRIGGER IF EXISTS update_users_updated_at ON users;</sql>
            <sql>DROP FUNCTION IF EXISTS update_updated_at_column();</sql>
        </rollback>
    </changeSet>
</databaseChangeLog>